{"$schema":"https://json-schema.org/draft/2020-12/schema","type":"object","required":["schema_version","package_id","project","source_document","assets","columns","processes","lineage_edges"],"properties":{"schema_version":{"const":"1.0.0"},"package_id":{"type":"string"},"project":{"type":"object","required":["name"],"properties":{"name":{"type":"string"},"business_domain":{"type":"string"},"migration_wave":{"type":"string"}}},"source_document":{"type":"object","required":["document_id","file_name","file_type","system","parser","extraction_timestamp"],"properties":{"document_id":{"type":"string"},"file_name":{"type":"string"},"file_type":{"enum":["SAS_PROGRAM","SNOWFLAKE_SQL","SQL","PYTHON","DBT_MODEL","NOTEBOOK","INFORMATICA_MAPPING","ADF_PIPELINE","AIRFLOW_DAG","POWERBI_MODEL","EXCEL","CSV","UNKNOWN"]},"system":{"type":"string"},"parser":{"enum":["AI","MANUAL","OTHER"]},"parser_version":{"type":["string","null"]},"extraction_timestamp":{"type":"string"}}},"assets":{"type":"array","items":{"type":"object","required":["asset_key","system_name","asset_type","qualified_name"],"properties":{"asset_key":{"type":"string"},"system_name":{"type":"string"},"environment":{"type":"string"},"namespace":{"type":"string"},"qualified_name":{"type":"string"},"display_name":{"type":"string"},"asset_type":{"type":"string"},"confidence_score":{"type":"number"}}}},"columns":{"type":"array","items":{"type":"object","required":["asset_ref","column_name"],"properties":{"asset_ref":{"type":"string"},"column_name":{"type":"string"},"ordinal_position":{"type":"integer"},"data_type":{"type":"string"}}}},"processes":{"type":"array","items":{"type":"object","properties":{"process_key":{"type":"string"},"system_name":{"type":"string"},"process_type":{"type":"string"},"process_name":{"type":"string"},"sequence_number":{"type":"integer"},"source_code_reference":{"type":"string"},"code_snippet":{"type":"string"},"confidence_score":{"type":"number"}}}},"lineage_edges":{"type":"array","items":{"type":"object","required":["source_asset_ref","target_asset_ref","lineage_level"],"properties":{"source_asset_ref":{"type":"string"},"source_column":{"type":"string"},"target_asset_ref":{"type":"string"},"target_column":{"type":"string"},"process_ref":{"type":"string"},"lineage_level":{"enum":["TABLE","COLUMN"]},"transformation_type":{"type":"string"},"transformation_expression":{"type":"string"},"evidence_code_snippet":{"type":"string"},"evidence_start_line":{"type":"integer"},"evidence_end_line":{"type":"integer"},"confidence_score":{"type":"number"}}}},"migration_mappings":{"type":"array"},"validation_hints":{"type":"array"},"unresolved_items":{"type":"array"},"assumptions":{"type":"array"}},"additionalProperties":true}
