{"schema_version":"1.0.0","package_id":"sas-claims-seed","project":{"name":"Claims Analytics Modernization","business_domain":"Claims","migration_wave":"Wave 1"},"source_document":{"document_id":"doc-sas-001","file_name":"claims_transform.sas","file_type":"SAS_PROGRAM","system":"SAS","parser":"AI","parser_version":"demo-1","extraction_timestamp":"2026-06-18T00:00:00Z"},"assets":[{"asset_key":"sas_program","system_name":"SAS","environment":"PROD","namespace":"code","qualified_name":"claims_transform.sas","display_name":"claims_transform.sas","asset_type":"PROGRAM"},{"asset_key":"sas_raw_claims","system_name":"SAS","environment":"PROD","namespace":"RAW","qualified_name":"RAW.CLAIMS","display_name":"CLAIMS","asset_type":"TABLE"},{"asset_key":"sas_clean","system_name":"SAS","environment":"PROD","namespace":"WORK","qualified_name":"WORK.CLAIMS_CLEAN","display_name":"CLAIMS_CLEAN","asset_type":"TABLE"},{"asset_key":"sas_summary","system_name":"SAS","environment":"PROD","namespace":"MART","qualified_name":"MART.CLAIMS_SUMMARY","display_name":"CLAIMS_SUMMARY","asset_type":"TABLE"}],"columns":[{"asset_ref":"sas_raw_claims","column_name":"claim_id","ordinal_position":1,"data_type":"CHAR"},{"asset_ref":"sas_raw_claims","column_name":"loss_amount","ordinal_position":2,"data_type":"NUM"},{"asset_ref":"sas_raw_claims","column_name":"expense_amount","ordinal_position":3,"data_type":"NUM"},{"asset_ref":"sas_raw_claims","column_name":"accident_date","ordinal_position":4,"data_type":"DATE"},{"asset_ref":"sas_clean","column_name":"claim_id","data_type":"CHAR"},{"asset_ref":"sas_clean","column_name":"paid_loss_amount","data_type":"NUM"},{"asset_ref":"sas_clean","column_name":"paid_expense_amount","data_type":"NUM"},{"asset_ref":"sas_summary","column_name":"total_incurred","data_type":"NUM"},{"asset_ref":"sas_summary","column_name":"accident_month","data_type":"CHAR"}],"processes":[{"process_key":"sas_clean_step","system_name":"SAS","process_type":"SAS DATA step","process_name":"Clean claims DATA step","sequence_number":1,"source_code_reference":"claims_transform.sas","code_snippet":"data work.claims_clean; set raw.claims;","confidence_score":0.91},{"process_key":"sas_summary_step","system_name":"SAS","process_type":"PROC SQL","process_name":"Summarize claims PROC SQL","sequence_number":2,"source_code_reference":"claims_transform.sas","code_snippet":"create table mart.claims_summary as select ...","confidence_score":0.88}],"lineage_edges":[{"source_asset_ref":"sas_raw_claims","target_asset_ref":"sas_clean","process_ref":"sas_clean_step","lineage_level":"TABLE","transformation_type":"FILTERED","transformation_expression":"Filter invalid claims and rename paid amounts","evidence_code_snippet":"set raw.claims; if claim_id ne '';","confidence_score":0.91},{"source_asset_ref":"sas_clean","target_asset_ref":"sas_summary","process_ref":"sas_summary_step","lineage_level":"TABLE","transformation_type":"AGGREGATED","transformation_expression":"Aggregate clean claims by accident month","evidence_code_snippet":"group by accident_month","confidence_score":0.88},{"source_asset_ref":"sas_raw_claims","source_column":"claim_id","target_asset_ref":"sas_clean","target_column":"claim_id","process_ref":"sas_clean_step","lineage_level":"COLUMN","transformation_type":"DIRECT_COPY","transformation_expression":"claim_id","confidence_score":0.95},{"source_asset_ref":"sas_raw_claims","source_column":"loss_amount","target_asset_ref":"sas_clean","target_column":"paid_loss_amount","process_ref":"sas_clean_step","lineage_level":"COLUMN","transformation_type":"RENAME","transformation_expression":"loss_amount as paid_loss_amount","confidence_score":0.92},{"source_asset_ref":"sas_raw_claims","source_column":"expense_amount","target_asset_ref":"sas_clean","target_column":"paid_expense_amount","process_ref":"sas_clean_step","lineage_level":"COLUMN","transformation_type":"RENAME","transformation_expression":"expense_amount as paid_expense_amount","confidence_score":0.92},{"source_asset_ref":"sas_clean","source_column":"paid_loss_amount","target_asset_ref":"sas_summary","target_column":"total_incurred","process_ref":"sas_summary_step","lineage_level":"COLUMN","transformation_type":"DERIVED","transformation_expression":"sum(paid_loss_amount + paid_expense_amount)","confidence_score":0.86},{"source_asset_ref":"sas_raw_claims","source_column":"accident_date","target_asset_ref":"sas_summary","target_column":"accident_month","process_ref":"sas_summary_step","lineage_level":"COLUMN","transformation_type":"DERIVED","transformation_expression":"put(accident_date,yymmn6.)","confidence_score":0.84}],"migration_mappings":[],"validation_hints":[],"unresolved_items":[],"assumptions":[]}
